{
  "id": "qs_1",
  "resume_upload_id": "r_123",
  "questions": [
    {
      "id": "q_789",
      "text": "Why did you pick PostgreSQL over a simpler database for the expense tracker?",
      "hint": "Talk about the data you stored, any relations between tables, and what you traded off.",
      "type": "project",
      "difficulty": "medium",
      "project_id": "p1",
      "evidence": [
        {
          "kind": "chunk",
          "ref_id": "p1-readme-03",
          "quote": "The app uses PostgreSQL with a nightly backup job"
        }
      ]
    },
    {
      "id": "q_exp_001",
      "text": "Your expense tracker joins multiple tables for analytics. How would you approach optimizing a slow query that joins your expenses, categories, and merchants tables?",
      "hint": "Discuss indexing strategies, query planning, and when you might denormalize.",
      "type": "experience",
      "difficulty": "hard",
      "project_id": null,
      "evidence": [
        {
          "kind": "chunk",
          "ref_id": "p1-readme-03",
          "quote": "normalized schema with categories, merchants, and recurring transactions"
        },
        {
          "kind": "experience",
          "ref_id": "e_456",
          "quote": "Asked how to speed up a slow query that joined three tables with millions of rows"
        }
      ]
    }
  ],
  "status": "ready",
  "created_at": "2026-10-03T10:00:00Z"
}